{
  "$schema": "http://json-schema.org/draft-04/schema#",
  "id": "companion-cards.json#",
  "title": "Schema for the companion cards data file",
  "type": "object",
  "definitions": {},
  "properties": {
    "id": {
      "description": "Id for entry: a UUID (see docs/data-model.md).",
      "$ref": "definitions.json#/definitions/uuid"
    },
    "name": {
      "type": "string",
      "description": "Companion card name",
      "minLength": 1
    },
    "iaspec": {
      "type": "string",
      "description": "iaspec code",
      "minLength": 1
    },
    "back_id": {
      "description": "Foreign key to this card's back in data/card-backs.json.",
      "$ref": "definitions.json#/definitions/uuid"
    },
    "image": {
      "description": "The file path for this companion card's image.",
      "$ref": "definitions.json#/definitions/image-file-path"
    },
    "traits": {
      "type": "array",
      "minItems": 1,
      "description": "Traits that apply to this companion card.",
      "uniqueItems": true,
      "items": {
        "description": "A trait that applies to this companion.",
        "$ref": "definitions.json#/definitions/deployment-trait"
      }
    },
    "health": {
      "type": "integer",
      "description": "This companion's health",
      "minimum": 1
    },
    "speed": {
      "type": "integer",
      "description": "This companion's speed",
      "minimum": 1
    }
  },
  "required": [
    "id",
    "iaspec",
    "name",
    "back_id",
    "image",
    "traits",
    "health",
    "speed"
  ],
  "additionalProperties": false
}